{
  "schema_version": 2,
  "scope": "project",
  "display": {
    "group_cues": [
      "color",
      "text",
      "shape",
      "pattern"
    ],
    "surface_intensity": "subdued",
    "contrast": "standard",
    "text_scale": 1.25,
    "line_height": 1.6,
    "appearance": {
      "mode": "skin",
      "id": "guillermo"
    },
    "text_style": "system"
  },
  "layout": {
    "density": "comfortable",
    "view": "overview",
    "multiple_sections_open": true
  },
  "sensory": {
    "reduce_motion": true,
    "autoplay": false,
    "sounds": false
  },
  "attention": {
    "optional_notifications": "batched",
    "live_updates": "manual"
  },
  "support": {
    "return_summary": true,
    "step_guidance": null,
    "larger_targets": true,
    "help_detail": "expanded"
  },
  "retention": {
    "remember_location": true,
    "retain_drafts": null
  }
}
